{
  "metadata": {
    "id": "rose-gold",
    "name": "Rose Gold",
    "description": "Warm and elegant rose gold with burgundy undertones",
    "author": "Ktheme",
    "version": "1.0.0",
    "tags": ["metallic", "warm", "elegant", "dark"],
    "createdAt": "2026-02-15T20:42:39.611Z",
    "updatedAt": "2026-02-15T20:42:39.611Z"
  },
  "darkMode": true,
  "colorScheme": {
    "error": "#FFB4AB",
    "onError": "#690005",
    "errorContainer": "#93000A",
    "onErrorContainer": "#FFDAD6",
    "primary": "#C1818B",
    "onPrimary": "#3D1F2B",
    "primaryContainer": "#7D4A52",
    "onPrimaryContainer": "#F5D5D8",
    "secondary": "#D4A5A5",
    "onSecondary": "#3D1F2B",
    "secondaryContainer": "#8C6969",
    "onSecondaryContainer": "#F5E5E5",
    "tertiary": "#C9A9A9",
    "onTertiary": "#3D2929",
    "tertiaryContainer": "#8A7474",
    "onTertiaryContainer": "#F5EAEA",
    "background": "#3D1F2B",
    "onBackground": "#F5E5E8",
    "surface": "#4D2F3B",
    "onSurface": "#F5E5E8",
    "surfaceVariant": "#5D3F4B",
    "onSurfaceVariant": "#E5D5D8",
    "outline": "#9E8A8E",
    "outlineVariant": "#4E3A3E",
    "scrim": "#000000",
    "inverseSurface": "#F5E5E8",
    "inverseOnSurface": "#3D1F2B",
    "inversePrimary": "#8A5A64"
  },
  "effects": {
    "metallic": {
      "enabled": true,
      "variant": "ROSE_GOLD",
      "gradient": {
        "base": "#B76E79",
        "highlight": "#E5BE8A",
        "shadow": "#7D4A52",
        "shimmer": "#F5D5D8"
      },
      "intensity": 0.75
    },
    "shadows": {
      "enabled": true,
      "elevation": 2,
      "blur": 4,
      "color": "#00000044"
    },
    "shimmer": {
      "enabled": true,
      "speed": 4,
      "intensity": 0.5,
      "angle": 120
    }
  },
  "adaptation": {
    "desktopAdaptation": {
      "windowChrome": {
        "titleBarHeight": 26,
        "headerStyle": "standard",
        "cornerStyle": "rounded",
        "panelRadius": 10,
        "controlRadius": 8,
        "borderWidth": 1,
        "shadow": "0 14px 36px rgba(0,0,0,0.5)"
      },
      "menuBar": {
        "height": 28,
        "fontSize": 11,
        "letterSpacing": "0.06em",
        "textTransform": "uppercase",
        "dropdownRadius": 10,
        "dropdownShadow": "0 12px 28px rgba(0,0,0,0.4)"
      },
      "taskbar": {
        "height": 40,
        "buttonRadius": 8,
        "dockAlignment": "left",
        "quickChatBorderRadius": 8
      },
      "cameraHud": {
        "panelRadius": 10,
        "buttonRadius": 8,
        "shadow": "0 8px 20px rgba(0,0,0,0.3)"
      },
      "sweep": {
        "elbowWidth": 30,
        "titleCapRadius": "10px",
        "accentBand": "primary",
        "showElbowBar": true
      }
    }
  },
  "schemaVersion": 2
}
