{
  "metadata": {
    "id": "emerald-silver",
    "name": "Emerald Silver",
    "description": "Rich emerald green with elegant silver metallic accents",
    "author": "Ktheme",
    "version": "1.0.0",
    "tags": ["metallic", "nature", "dark"],
    "createdAt": "2026-02-15T20:42:39.610Z",
    "updatedAt": "2026-02-15T20:42:39.610Z"
  },
  "darkMode": true,
  "colorScheme": {
    "primary": "#C0C0C0",
    "onPrimary": "#0D3B2E",
    "primaryContainer": "#505050",
    "onPrimaryContainer": "#F5F5F5",
    "secondary": "#50C878",
    "onSecondary": "#FFFFFF",
    "secondaryContainer": "#2E7D5A",
    "onSecondaryContainer": "#E7F9F1",
    "tertiary": "#8BA888",
    "onTertiary": "#FFFFFF",
    "tertiaryContainer": "#5D7A5A",
    "onTertiaryContainer": "#E8F5E8",
    "error": "#CF6679",
    "onError": "#FFFFFF",
    "errorContainer": "#93000A",
    "onErrorContainer": "#FFDAD6",
    "background": "#0D3B2E",
    "onBackground": "#E8F5E8",
    "surface": "#1A5544",
    "onSurface": "#E8F5E8",
    "surfaceVariant": "#2A6554",
    "onSurfaceVariant": "#C9E4D9",
    "outline": "#C3CDC8",
    "outlineVariant": "#3E4E44",
    "scrim": "#000000",
    "inverseSurface": "#E8F5E8",
    "inverseOnSurface": "#0D3B2E",
    "inversePrimary": "#6B6B6B"
  },
  "effects": {
    "metallic": {
      "enabled": true,
      "variant": "SILVER",
      "gradient": {
        "base": "#C0C0C0",
        "highlight": "#F5F5F5",
        "shadow": "#505050",
        "shimmer": "#E5E4E2"
      },
      "intensity": 0.7
    },
    "shadows": {
      "enabled": true,
      "elevation": 3,
      "blur": 6,
      "color": "#00000055"
    }
  }
}
