{
  "metadata": {
    "id": "charcoal-champagne",
    "name": "Charcoal Champagne",
    "description": "Sophisticated charcoal gray with warm champagne accents",
    "author": "Ktheme",
    "version": "1.0.0",
    "tags": [
      "metallic",
      "sophisticated",
      "dark"
    ],
    "createdAt": "2026-02-15T20:42:39.611Z",
    "updatedAt": "2026-02-15T20:42:39.611Z"
  },
  "darkMode": true,
  "colorScheme": {
    "primary": "#F7E7CE",
    "onPrimary": "#1F1F1F",
    "primaryContainer": "#C5B8A5",
    "onPrimaryContainer": "#FFF5E6",
    "secondary": "#3D3D3D",
    "onSecondary": "#F5F5F5",
    "secondaryContainer": "#2A2A2A",
    "onSecondaryContainer": "#F5F5F5",
    "tertiary": "#D4C4A8",
    "onTertiary": "#1F1F1F",
    "tertiaryContainer": "#A89C86",
    "onTertiaryContainer": "#FFF5E6",
    "error": "#CF6679",
    "onError": "#FFFFFF",
    "errorContainer": "#93000A",
    "onErrorContainer": "#FFDAD6",
    "background": "#1F1F1F",
    "onBackground": "#F5F5F5",
    "surface": "#2A2A2A",
    "onSurface": "#F5F5F5",
    "surfaceVariant": "#3D3D3D",
    "onSurfaceVariant": "#D0D0D0",
    "outline": "#9A9A9A",
    "outlineVariant": "#4D4D4D",
    "scrim": "#000000",
    "inverseSurface": "#F5F5F5",
    "inverseOnSurface": "#1F1F1F",
    "inversePrimary": "#9A8970"
  },
  "effects": {
    "metallic": {
      "enabled": true,
      "variant": "GOLD",
      "gradient": {
        "base": "#D4AF37",
        "highlight": "#FFD700",
        "shadow": "#856D34",
        "shimmer": "#FFF8DC"
      },
      "intensity": 0.65
    },
    "shadows": {
      "enabled": true,
      "elevation": 2,
      "blur": 4,
      "color": "#00000044"
    }
  }
}