{
  "schemaVersion": 2,
  "metadata": {
    "id": "deep-purple-platinum",
    "name": "Deep Purple Platinum",
    "description": "Deep purple background with luxurious platinum metallic accents",
    "author": "Ktheme",
    "version": "1.0.0",
    "tags": [
      "metallic",
      "luxurious",
      "dark"
    ],
    "createdAt": "2026-02-15T20:42:39.611Z",
    "updatedAt": "2026-02-15T20:42:39.611Z"
  },
  "darkMode": true,
  "colorScheme": {
    "error": "#CF6679",
    "onError": "#FFFFFF",
    "errorContainer": "#93000A",
    "onErrorContainer": "#FFDAD6",
    "primary": "#E5E4E2",
    "onPrimary": "#1A0F2E",
    "primaryContainer": "#B8B7B5",
    "onPrimaryContainer": "#F5F4F2",
    "secondary": "#2E1A50",
    "onSecondary": "#F0EBFF",
    "secondaryContainer": "#24153D",
    "onSecondaryContainer": "#F0EBFF",
    "tertiary": "#C8BFE0",
    "onTertiary": "#1A0F2E",
    "tertiaryContainer": "#9F99B3",
    "onTertiaryContainer": "#F0EBFF",
    "background": "#1A0F2E",
    "onBackground": "#F0EBFF",
    "surface": "#24153D",
    "onSurface": "#F0EBFF",
    "surfaceVariant": "#3D2A5C",
    "onSurfaceVariant": "#D0C0E6",
    "outline": "#9B8AB8",
    "outlineVariant": "#4D3F6D",
    "scrim": "#000000",
    "inverseSurface": "#F0EBFF",
    "inverseOnSurface": "#1A0F2E",
    "inversePrimary": "#9A9998"
  },
  "effects": {
    "metallic": {
      "enabled": true,
      "variant": "PLATINUM",
      "gradient": {
        "base": "#E5E4E2",
        "highlight": "#F5F5F5",
        "shadow": "#9E9E9E",
        "shimmer": "#FFFFFF"
      },
      "intensity": 0.8
    },
    "shadows": {
      "enabled": true,
      "elevation": 4,
      "blur": 8,
      "color": "#00000066"
    }
  },
  "adaptation": {}
}
