{
  "metadata": {
    "id": "navy-gold",
    "name": "Navy Gold",
    "description": "Elegant navy background with luxurious gold metallic accents",
    "author": "Ktheme",
    "version": "1.0.0",
    "tags": ["metallic", "elegant", "dark"],
    "createdAt": "2026-02-15T20:42:39.610Z",
    "updatedAt": "2026-02-15T20:42:39.610Z"
  },
  "darkMode": true,
  "colorScheme": {
    "primary": "#D4AF37",
    "onPrimary": "#0A1630",
    "primaryContainer": "#856D34",
    "onPrimaryContainer": "#FFF8DC",
    "secondary": "#4A90E2",
    "onSecondary": "#FFFFFF",
    "secondaryContainer": "#2C5F9E",
    "onSecondaryContainer": "#E3F2FD",
    "tertiary": "#9C8970",
    "onTertiary": "#FFFFFF",
    "tertiaryContainer": "#6B5D4F",
    "onTertiaryContainer": "#F5E6D3",
    "error": "#CF6679",
    "onError": "#FFFFFF",
    "errorContainer": "#93000A",
    "onErrorContainer": "#FFDAD6",
    "background": "#0A1630",
    "onBackground": "#E8E3D8",
    "surface": "#1A2645",
    "onSurface": "#E8E3D8",
    "surfaceVariant": "#2A3655",
    "onSurfaceVariant": "#C9C4B9",
    "outline": "#B4B2AA",
    "outlineVariant": "#44483E",
    "scrim": "#000000",
    "inverseSurface": "#E8E3D8",
    "inverseOnSurface": "#0A1630",
    "inversePrimary": "#6D5D28"
  },
  "effects": {
    "metallic": {
      "enabled": true,
      "variant": "GOLD_ROYAL_BLUE",
      "gradient": {
        "base": "#D4AF37",
        "highlight": "#FFD700",
        "shadow": "#0A1630",
        "shimmer": "#FFF8DC"
      },
      "intensity": 0.8
    },
    "shadows": {
      "enabled": true,
      "elevation": 4,
      "blur": 8,
      "color": "#00000066"
    },
    "shimmer": {
      "enabled": true,
      "speed": 3,
      "intensity": 0.6,
      "angle": 135
    }
  },
  "typography": {
    "fontFamily": "system-ui, -apple-system, sans-serif",
    "fontSize": {
      "small": 12,
      "medium": 16,
      "large": 20,
      "xlarge": 28
    },
    "fontWeight": {
      "light": 300,
      "regular": 400,
      "medium": 500,
      "bold": 700
    },
    "lineHeight": 1.5,
    "letterSpacing": 0
  }
}
