{
  "metadata": {
    "id": "paper-ink",
    "name": "Paper & Ink",
    "description": "Minimalist light theme for comfortable reading",
    "author": "Ktheme",
    "version": "1.0.0",
    "tags": ["minimalist", "light", "reader"],
    "createdAt": "2026-02-15T20:42:39.611Z",
    "updatedAt": "2026-02-15T20:42:39.611Z"
  },
  "darkMode": false,
  "colorScheme": {
    "primary": "#2C2C2C",
    "onPrimary": "#FAF9F6",
    "primaryContainer": "#454545",
    "onPrimaryContainer": "#FAF9F6",
    "secondary": "#595959",
    "onSecondary": "#FAF9F6",
    "secondaryContainer": "#737373",
    "onSecondaryContainer": "#FCFBF9",
    "tertiary": "#6B6B6B",
    "onTertiary": "#FAF9F6",
    "tertiaryContainer": "#828282",
    "onTertiaryContainer": "#FAF9F6",
    "error": "#BA1A1A",
    "onError": "#FFFFFF",
    "errorContainer": "#FFDAD6",
    "onErrorContainer": "#410002",
    "background": "#F0F0EB",
    "onBackground": "#2C2C2C",
    "surface": "#FAF9F6",
    "onSurface": "#2C2C2C",
    "surfaceVariant": "#EBEAE4",
    "onSurfaceVariant": "#454545",
    "outline": "#282828",
    "outlineVariant": "#C9C9C9",
    "scrim": "#000000",
    "inverseSurface": "#2C2C2C",
    "inverseOnSurface": "#FAF9F6",
    "inversePrimary": "#9A9A9A"
  },
  "effects": {
    "shadows": {
      "enabled": true,
      "elevation": 1,
      "blur": 2,
      "color": "#00000011"
    }
  }
}
