{
  "schemaVersion": 2,
  "metadata": {
    "id": "rose-gold",
    "name": "Rose Gold",
    "description": "Warm and elegant rose gold with burgundy undertones",
    "author": "Ktheme",
    "version": "1.0.0",
    "tags": ["metallic", "warm", "elegant", "dark"],
    "createdAt": "2026-02-15T20:42:39.611Z",
    "updatedAt": "2026-02-15T20:42:39.611Z"
  },
  "darkMode": true,
  "colorScheme": {
    "error": "#FFB4AB",
    "onError": "#690005",
    "errorContainer": "#93000A",
    "onErrorContainer": "#FFDAD6",
    "primary": "#B76E79",
    "onPrimary": "#3D1F2B",
    "primaryContainer": "#7D4A52",
    "onPrimaryContainer": "#F5D5D8",
    "secondary": "#D4A5A5",
    "onSecondary": "#442929",
    "secondaryContainer": "#8C6969",
    "onSecondaryContainer": "#FCF7F7",
    "tertiary": "#C9A9A9",
    "onTertiary": "#3D2929",
    "tertiaryContainer": "#8A7474",
    "onTertiaryContainer": "#F5EAEA",
    "background": "#3D1F2B",
    "onBackground": "#F5E5E8",
    "surface": "#4D2F3B",
    "onSurface": "#F5E5E8",
    "surfaceVariant": "#5D3F4B",
    "onSurfaceVariant": "#E5D5D8",
    "outline": "#D4CCCD",
    "outlineVariant": "#4E3A3E",
    "scrim": "#000000",
    "inverseSurface": "#F5E5E8",
    "inverseOnSurface": "#3D1F2B",
    "inversePrimary": "#8A5A64"
  },
  "effects": {
    "metallic": {
      "enabled": true,
      "variant": "ROSE_GOLD",
      "gradient": {
        "base": "#B76E79",
        "highlight": "#E5BE8A",
        "shadow": "#7D4A52",
        "shimmer": "#F5D5D8"
      },
      "intensity": 0.75
    },
    "shadows": {
      "enabled": true,
      "elevation": 2,
      "blur": 4,
      "color": "#00000044"
    },
    "shimmer": {
      "enabled": true,
      "speed": 4,
      "intensity": 0.5,
      "angle": 120
    }
  },
  "adaptation": {}
}
