{
  "schemaVersion": 2,
  "metadata": {
    "id": "calm-clinical",
    "name": "Calm Clinical",
    "description": "Low-stress healthcare/admin palette with clear status readability",
    "author": "Ktheme",
    "version": "1.0.0",
    "tags": [
      "minimalist",
      "light",
      "reader",
      "clinical",
      "accessibility",
      "calm"
    ],
    "createdAt": "2026-02-16T13:00:59.876Z",
    "updatedAt": "2026-02-16T13:00:59.876Z"
  },
  "darkMode": false,
  "colorScheme": {
    "error": "#BA1A1A",
    "onError": "#FFFFFF",
    "errorContainer": "#FFDAD6",
    "onErrorContainer": "#410002",
    "primary": "#3A7CA5",
    "onPrimary": "#F3FAFF",
    "primaryContainer": "#C4DFF2",
    "onPrimaryContainer": "#17374D",
    "secondary": "#4DAA7C",
    "onSecondary": "#062A1C",
    "secondaryContainer": "#CBEFDF",
    "onSecondaryContainer": "#184933",
    "tertiary": "#7D9AB2",
    "onTertiary": "#0E2333",
    "tertiaryContainer": "#D8E6F0",
    "onTertiaryContainer": "#264256",
    "background": "#F5FAFD",
    "onBackground": "#1F394B",
    "surface": "#FFFFFF",
    "onSurface": "#1F394B",
    "surfaceVariant": "#E5EEF4",
    "onSurfaceVariant": "#445F72",
    "outline": "#6B8698",
    "outlineVariant": "#B5C8D5",
    "scrim": "#000000",
    "inverseSurface": "#1F394B",
    "inverseOnSurface": "#F5FAFD",
    "inversePrimary": "#295A7A"
  },
  "effects": {
    "shadows": {
      "enabled": true,
      "elevation": 1,
      "blur": 2,
      "color": "#00000011"
    }
  },
  "adaptation": {}
}
