{
  "metadata": {
    "id": "burgundy-rose-gold",
    "name": "Burgundy Rose Gold",
    "description": "Rich burgundy with elegant rose gold metallic accents",
    "author": "Ktheme",
    "version": "1.0.0",
    "tags": [
      "metallic",
      "elegant",
      "dark"
    ],
    "createdAt": "2026-02-15T20:42:39.611Z",
    "updatedAt": "2026-02-15T20:42:39.611Z"
  },
  "darkMode": true,
  "colorScheme": {
    "primary": "#B76E79",
    "onPrimary": "#2D0F1A",
    "primaryContainer": "#93575F",
    "onPrimaryContainer": "#D4969E",
    "secondary": "#4D1A2A",
    "onSecondary": "#FFE6ED",
    "secondaryContainer": "#3D1525",
    "onSecondaryContainer": "#FFE6ED",
    "tertiary": "#C99BA5",
    "onTertiary": "#2D0F1A",
    "tertiaryContainer": "#9F7A83",
    "onTertiaryContainer": "#FFE6ED",
    "error": "#FFB4AB",
    "onError": "#690005",
    "errorContainer": "#93000A",
    "onErrorContainer": "#FFDAD6",
    "background": "#2D0F1A",
    "onBackground": "#FFE6ED",
    "surface": "#3D1525",
    "onSurface": "#FFE6ED",
    "surfaceVariant": "#5C2A3D",
    "onSurfaceVariant": "#E6C0CC",
    "outline": "#B88A94",
    "outlineVariant": "#6D3F4D",
    "scrim": "#000000",
    "inverseSurface": "#FFE6ED",
    "inverseOnSurface": "#2D0F1A",
    "inversePrimary": "#8A575F"
  },
  "effects": {
    "metallic": {
      "enabled": true,
      "variant": "ROSE_GOLD",
      "gradient": {
        "base": "#B76E79",
        "highlight": "#E5BE8A",
        "shadow": "#7D4A52",
        "shimmer": "#F5D5D8"
      },
      "intensity": 0.8
    },
    "shadows": {
      "enabled": true,
      "elevation": 3,
      "blur": 6,
      "color": "#00000055"
    },
    "shimmer": {
      "enabled": true,
      "speed": 4,
      "intensity": 0.6,
      "angle": 120
    }
  }
}
